{
  "schema_version": "0.1.0",
  "scoring_enabled": false,
  "ward": {
    "country_code": "ZA",
    "province": "Limpopo",
    "municipality_code": "example-municipality",
    "ward_id": "example-ward",
    "boundary_version": "synthetic-v1"
  },
  "period": {
    "start": "2026-01-01T00:00:00+02:00",
    "end": "2026-01-02T00:00:00+02:00",
    "timezone": "Africa/Johannesburg",
    "resolution": "daily"
  },
  "generated_at": "2026-01-03T00:00:00Z",
  "components": {
    "pollution": {
      "status": "disabled_pending_review",
      "score": null,
      "reference_id": null,
      "observations": [
        {
          "variable": "pm25_ug_m3",
          "value": 18,
          "source": {
            "dataset_id": "synthetic-example",
            "band": "pm25_ug_m3",
            "product_version": "fixture-v1",
            "kind": "historical",
            "issue_time": null,
            "lead_hours": null
          },
          "aggregation": "area_weighted",
          "population_reference": null,
          "spatial_coverage": null,
          "temporal_coverage": null,
          "quality_flags": [
            "missing_coverage",
            "unverified_source"
          ],
          "eligible_for_reference": false
        }
      ]
    },
    "heat": {
      "status": "disabled_pending_review",
      "score": null,
      "reference_id": null,
      "observations": [
        {
          "variable": "air_temp_max_c",
          "value": 32,
          "source": {
            "dataset_id": "synthetic-example",
            "band": "air_temp_max_c",
            "product_version": "fixture-v1",
            "kind": "historical",
            "issue_time": null,
            "lead_hours": null
          },
          "aggregation": "area_weighted",
          "population_reference": null,
          "spatial_coverage": null,
          "temporal_coverage": null,
          "quality_flags": [
            "missing_coverage",
            "unverified_source"
          ],
          "eligible_for_reference": false
        }
      ]
    },
    "cold": {
      "status": "disabled_pending_review",
      "score": null,
      "reference_id": null,
      "observations": [
        {
          "variable": "air_temp_min_c",
          "value": 14,
          "source": {
            "dataset_id": "synthetic-example",
            "band": "air_temp_min_c",
            "product_version": "fixture-v1",
            "kind": "historical",
            "issue_time": null,
            "lead_hours": null
          },
          "aggregation": "area_weighted",
          "population_reference": null,
          "spatial_coverage": null,
          "temporal_coverage": null,
          "quality_flags": [
            "missing_coverage",
            "unverified_source"
          ],
          "eligible_for_reference": false
        }
      ]
    }
  },
  "combined_ncd_score": null
}
